{
  "deal_id": "DEAL-2026-0001",
  "company_name": "LinkLogis Pte Ltd",
  "submission_date": "2026-04-30",
  "dealmaker": {
    "name": "Sarah Chen",
    "email": "sarah@dealflow.io",
    "organization": "DealFlow Advisors",
    "phone": "+65-6123-4567"
  },
  "mandate_ids": [
    "tvp4-2026"
  ],
  "process_section": {
    "use_of_capital": "acquisition",
    "capital_use_details": "Acquire regional competitors in Southeast Asia to consolidate trade receivables financing platform. Target 3 acquisitions over 24 months to create pan-APAC player.",
    "hold_period_years": 4,
    "exit_strategy": "strategic_acquisition",
    "check_size_usd_millions": 20,
    "total_raise_usd_millions": 50,
    "projected_irr": 28,
    "irr_assumptions": "4-year hold, 3.5x revenue multiple exit (trading at 3x now), 40% annual organic growth + bolt-on accretion, $20M check gets 18% equity stake",
    "geographies": [
      "SG",
      "MY",
      "TH",
      "VN",
      "ID"
    ],
    "primary_sector": "fintech",
    "subsectors": [
      "trade_finance",
      "receivables_financing",
      "supply_chain"
    ],
    "value_drivers": [
      "bolt_on_acquisition",
      "organic_growth",
      "multiple_expansion"
    ],
    "value_driver_details": "Current platform has 15% quarterly growth. We acquire 2-3 smaller regional competitors at 1.5x revenue. Post-consolidation: (1) cross-sell to 5x customer base, (2) reduce CAC by 40% via integrated platform, (3) expand from $15M to $80M revenue by exit, (4) exit at 3.5x revenue vs. current 3x given scale and growth profile.",
    "decision_deadline": "2026-06-15"
  },
  "legal_section": {
    "governance_rights": [
      "board_seat",
      "information_rights",
      "veto_rights"
    ],
    "governance_details": "One board seat + quarterly financial reporting. Veto rights on: capital raises >$2M, debt >$5M, new customer commitments >$10M, management changes (CRO, CFO, CTO), asset sales.",
    "liquidation_preference": "participating",
    "anti_dilution": "broad_based_weighted_average",
    "non_compete_years": 2,
    "has_drag_along": true,
    "has_tag_along": true,
    "founder_vest_schedule": {
      "years": 4,
      "cliff_years": 1
    },
    "mac_clause_scope": "standard",
    "carveouts": [
      "founder_friendly",
      "equity_pool"
    ],
    "documents_attached": [
      "term_sheet_draft_v3.pdf",
      "cap_table_current.xlsx",
      "articles_of_association.pdf",
      "shareholder_agreement.pdf"
    ]
  },
  "compliance_section": {
    "jurisdictions": [
      {
        "country": "SG",
        "operations": "HQ + R&D",
        "risk_level": "low"
      },
      {
        "country": "MY",
        "operations": "Sales + operations",
        "risk_level": "low"
      },
      {
        "country": "TH",
        "operations": "Customer support",
        "risk_level": "low"
      },
      {
        "country": "VN",
        "operations": "Sales office",
        "risk_level": "low"
      },
      {
        "country": "ID",
        "operations": "Partner operations",
        "risk_level": "low"
      }
    ],
    "aml_kyc_status": "complete",
    "aml_kyc_notes": "All beneficial owners (3) and board members (5) completed third-party KYC verification via Compliance Labs on 2026-04-20. All clear.",
    "sanctions_screening_result": "clean",
    "pep_screening_result": "clean",
    "primary_sector": "fintech",
    "sector_status": "allowed",
    "export_control_status": "not_applicable",
    "esg_rating": "green",
    "esg_notes": "SOC 2 Type II certified (2025). Female CEO and CFO. Diversity: 42% women in workforce, 28% in tech. No labor violations. Board has 2 independent directors. Anti-bribery training mandatory.",
    "data_privacy_status": "compliant",
    "reputational_risk_level": "clear",
    "reputational_notes": "No major controversies. One minor employment dispute settled in 2024 (unrelated to current management). Clean media record. No litigation threats.",
    "benefical_ownership": [
      {
        "name": "Rajesh Kumar",
        "nationality": "SG",
        "ownership_percent": 35,
        "pep_status": "clean",
        "sanctions_status": "clean"
      },
      {
        "name": "Mei-Li Wong",
        "nationality": "SG",
        "ownership_percent": 30,
        "pep_status": "clean",
        "sanctions_status": "clean"
      },
      {
        "name": "Current Employee Fund",
        "nationality": "SG",
        "ownership_percent": 25,
        "pep_status": "n/a",
        "sanctions_status": "n/a"
      },
      {
        "name": "Early Investors (AngelVest)",
        "nationality": "SG",
        "ownership_percent": 10,
        "pep_status": "clean",
        "sanctions_status": "clean"
      }
    ]
  },
  "financial_highlights": {
    "current_year_revenue_usd_millions": 12,
    "annual_growth_rate_percent": 40,
    "profitability_status": "cash_burn",
    "runway_months": 18,
    "current_valuation_usd_millions": 90,
    "post_investment_valuation_usd_millions": 110
  },
  "team": {
    "ceo": {
      "name": "Mei-Li Wong",
      "background": "Ex-DBS Bank (fintech lead), 12 years trade finance experience, MBA from NUS"
    },
    "key_executives": [
      {
        "name": "Rajesh Kumar",
        "role": "Co-founder & CTO",
        "background": "Ex-Stripe (payment systems), 10 years, Singapore Tech Award winner"
      },
      {
        "name": "James Tan",
        "role": "CFO",
        "background": "Ex-Goldman Sachs (Singapore desk), 8 years finance/M&A"
      },
      {
        "name": "Anita Narayan",
        "role": "Head of Sales",
        "background": "Ex-Temenos (APAC sales), $50M+ pipeline experience"
      }
    ]
  },
  "attachments": [
    "executive_summary.pdf",
    "financial_model_3_year.xlsx",
    "pitch_deck_april_2026.pdf",
    "cap_table_full_history.xlsx",
    "customer_list_redacted.xlsx",
    "technical_architecture.pdf",
    "kyc_verification_summary.pdf"
  ],
  "notes": "Strong founding team with deep fintech and trade finance expertise. Rapid growth (40% YoY) and clear path to profitability. Trade receivables is $2.5T global market with <3% digital penetration in APAC. Company is addressing the wedge use case (small/medium supplier financing) where manual processes cost institutional investors $500B+ in lost productivity annually. Strategic buyer interest from regional banks."
}
